{
  "schema_version": "3.0",
  "document": "Testkatalog",
  "as_of": "2026-09-24",
  "rule": "Jeder Test mit Prozedur, Orakel und Bestehenskriterium; Killer-Tests zuerst (§17.4). IM_PAKET-Tests laufen in der Paketprüfung; BROKER-, BAU- und BETRIEB-Tests sind spezifiziert und werden in der genannten Stufe ausgeführt.",
  "levels": [
    "UNIT",
    "PROPERTY",
    "SIMULATION",
    "INTEGRATION",
    "BROKER_CERT",
    "LOAD",
    "SOAK",
    "CHAOS",
    "FAULT_INJECTION",
    "MUTATION",
    "SECURITY",
    "DRILL",
    "STATIC"
  ],
  "execution_values": {
    "IM_PAKET": "läuft heute in der Paketprüfung",
    "BROKER": "Killer-Tests beim Broker (BS-01)",
    "BAU": "Abnahme im Systembau (BS-05/BS-06)",
    "BETRIEB": "Drills, Dauerläufe und Messungen im Betrieb"
  },
  "tests": [
    {
      "id": "KT-01",
      "title": "Symboleigenschaften",
      "level": "BROKER_CERT",
      "component": "C-MT5",
      "stage": "BS-01",
      "gate": "GATE-G1",
      "procedure": "`symbol_info()` je Zielkontrakt: Ausführungs- und Füllmodus, Handelsmodus, Kontraktgröße, Tick, Tickwert, Mindest- und Schrittvolumen, Margins, Verfall",
      "oracle": "Werte stimmen mit `registers/instruments.json` und Börsenspezifikation überein; Tickwert = Kontraktgröße × Tick",
      "pass_criterion": "Orakel erfüllt oder Rückfallvariante gewählt und signiert; Protokoll mit Rohantworten",
      "execution": "BROKER",
      "automation": "HALBAUTOMATISCH",
      "params": [],
      "status": "SPEZIFIZIERT",
      "fallback": "Brokerwerte nach schriftlicher Bestätigung übernehmen",
      "failure_effect": "Instrument gesperrt bis zur Klärung",
      "account": "Demo",
      "killer_first_rank": 1,
      "requirements": [],
      "scenarios": []
    },
    {
      "id": "KT-02",
      "title": "Kontoeigenschaften",
      "level": "BROKER_CERT",
      "component": "C-MT5",
      "stage": "BS-01",
      "gate": "GATE-G1",
      "procedure": "`account_info()`: Margin-Modus (Hedging/Netting), FIFO-Regel, Margin-Call- und Stop-out-Level, Expertenhandel, Kontotyp",
      "oracle": "Hedging oder Netting eindeutig; Stop-out-Level lesbar und gleich der Brokerangabe (X-BRK-LIQ)",
      "pass_criterion": "Orakel erfüllt oder Rückfallvariante gewählt und signiert; Protokoll mit Rohantworten",
      "execution": "BROKER",
      "automation": "HALBAUTOMATISCH",
      "params": [],
      "status": "SPEZIFIZIERT",
      "fallback": "Netting-Variante des Adapters",
      "failure_effect": "ohne lesbares Stop-out-Level kein Echtgeld",
      "account": "Demo",
      "killer_first_rank": 2,
      "requirements": [],
      "scenarios": []
    },
    {
      "id": "KT-03",
      "title": "Zeitstempel",
      "level": "BROKER_CERT",
      "component": "C-MT5",
      "stage": "BS-01",
      "gate": "GATE-G1",
      "procedure": "Tick- und Deal-Zeiten gegen NTP-UTC, auch über eine Sommerzeitumstellung",
      "oracle": "konstanter, erklärbarer Versatz; keine Sprünge außer an Umstellungstagen",
      "pass_criterion": "Orakel erfüllt oder Rückfallvariante gewählt und signiert; Protokoll mit Rohantworten",
      "execution": "BROKER",
      "automation": "HALBAUTOMATISCH",
      "params": [],
      "status": "SPEZIFIZIERT",
      "fallback": "Versatztabelle je Datum; sonst nur Systemzeit",
      "failure_effect": "Datenzeitstempel nicht nutzbar für Kostenmessung",
      "account": "Demo",
      "killer_first_rank": 3,
      "requirements": [
        "REQ-EXE-011"
      ],
      "scenarios": []
    },
    {
      "id": "KT-04",
      "title": "Order-Lebenszyklus",
      "level": "BROKER_CERT",
      "component": "C-MT5",
      "stage": "BS-01",
      "gate": "GATE-G1",
      "procedure": "Limit- und Marktorder mit Minimalgröße; Retcode, `order`/`deal`, Latenz; `history_deals_get(position=…)`; Abgleich mit Auszug",
      "oracle": "jede Order über Order, Deal und Position bis zur Auszugszeile verfolgbar",
      "pass_criterion": "Orakel erfüllt oder Rückfallvariante gewählt und signiert; Protokoll mit Rohantworten",
      "execution": "BROKER",
      "automation": "HALBAUTOMATISCH",
      "params": [
        "P-EXE-KT-LOSS-CAP-EUR"
      ],
      "status": "SPEZIFIZIERT",
      "fallback": "keine",
      "failure_effect": "keine Automatisierung; nur V2 (manuell)",
      "account": "Demo und Echtgeld minimal",
      "killer_first_rank": 4,
      "requirements": [
        "REQ-EXE-005",
        "REQ-EXE-015"
      ],
      "scenarios": []
    },
    {
      "id": "KT-05",
      "title": "Zeitüberschreitung und Wiederholung",
      "level": "BROKER_CERT",
      "component": "C-MT5",
      "stage": "BS-01",
      "gate": "GATE-G1",
      "procedure": "Netz während `order_send` trennen; Wiederverbindung; Korrelation über `magic` und `comment`",
      "oracle": "kein Doppel-Fill; UNKNOWN wird über die Historie eindeutig geklärt; `comment` unverändert",
      "pass_criterion": "Orakel erfüllt oder Rückfallvariante gewählt und signiert; Protokoll mit Rohantworten",
      "execution": "BROKER",
      "automation": "HALBAUTOMATISCH",
      "params": [],
      "status": "SPEZIFIZIERT",
      "fallback": "Korrelation über `magic` und Zeitfenster; Einstiege nie wiederholen",
      "failure_effect": "keine Automatisierung",
      "account": "Demo",
      "killer_first_rank": 5,
      "requirements": [
        "REQ-EXE-002",
        "REQ-EXE-010"
      ],
      "scenarios": [
        "OS-EX-01"
      ]
    },
    {
      "id": "KT-06",
      "title": "serverseitiger Schutzstopp",
      "level": "BROKER_CERT",
      "component": "C-MT5",
      "stage": "BS-01",
      "gate": "GATE-G1",
      "procedure": "SL der Position; Auslösepreis (Last oder Bid/Ask), Slippage; Verhalten bei geschlossenem Terminal und nach VPS-Neustart",
      "oracle": "SL löst bei geschlossenem Terminal aus; Ausführung dokumentiert",
      "pass_criterion": "Orakel erfüllt oder Rückfallvariante gewählt und signiert; Protokoll mit Rohantworten",
      "execution": "BROKER",
      "automation": "HALBAUTOMATISCH",
      "params": [
        "P-EXE-KT-LOSS-CAP-EUR"
      ],
      "status": "SPEZIFIZIERT",
      "fallback": "Netting-Konto mit Stop-Order beim Broker",
      "failure_effect": "ohne serverseitigen Schutz kein Halten über Nacht → Haltehorizont nicht vertretbar, Projektstopp",
      "account": "Demo, Bestätigung Echtgeld minimal",
      "killer_first_rank": 6,
      "requirements": [
        "REQ-EXE-006"
      ],
      "scenarios": [
        "OS-EX-06"
      ]
    },
    {
      "id": "KT-07",
      "title": "Modify-Semantik",
      "level": "BROKER_CERT",
      "component": "C-MT5",
      "stage": "BS-01",
      "gate": "GATE-G1",
      "procedure": "SL enger setzen (TRADE_ACTION_SLTP), Pending Order ändern (MODIFY), stornieren; je Börsengruppe CME und Eurex",
      "oracle": "Änderung atomar; alter SL bleibt bis zur Bestätigung aktiv",
      "pass_criterion": "Orakel erfüllt oder Rückfallvariante gewählt und signiert; Protokoll mit Rohantworten",
      "execution": "BROKER",
      "automation": "HALBAUTOMATISCH",
      "params": [],
      "status": "SPEZIFIZIERT",
      "fallback": "Storno und Neuanlage nur für nicht schützende Orders",
      "failure_effect": "Schutzänderungen nur manuell; Einstiegssperre",
      "account": "Demo",
      "killer_first_rank": 7,
      "requirements": [
        "REQ-EXE-007"
      ],
      "scenarios": []
    },
    {
      "id": "KT-08",
      "title": "Preisbänder, Tageslimits, Parkpreise",
      "level": "BROKER_CERT",
      "component": "C-MT5",
      "stage": "BS-01",
      "gate": "GATE-G1",
      "procedure": "Limit außerhalb des Bands und am Tageslimit, besonders Agrar (CBOT)",
      "oracle": "dokumentierte Ablehnung mit eindeutigem Retcode",
      "pass_criterion": "Orakel erfüllt oder Rückfallvariante gewählt und signiert; Protokoll mit Rohantworten",
      "execution": "BROKER",
      "automation": "HALBAUTOMATISCH",
      "params": [],
      "status": "SPEZIFIZIERT",
      "fallback": "Preiskorridor enger als das Band (PTC-01)",
      "failure_effect": "Agrar-Kontrakte gesperrt",
      "account": "Demo",
      "killer_first_rank": 8,
      "requirements": [],
      "scenarios": []
    },
    {
      "id": "KT-09",
      "title": "Teilausführungen",
      "level": "BROKER_CERT",
      "component": "C-MT5",
      "stage": "BS-01",
      "gate": "GATE-G1",
      "procedure": "Limit größer als die angezeigte Menge; IOC und RETURN",
      "oracle": "Teilfills als eigene Deals, Restmenge korrekt",
      "pass_criterion": "Orakel erfüllt oder Rückfallvariante gewählt und signiert; Protokoll mit Rohantworten",
      "execution": "BROKER",
      "automation": "HALBAUTOMATISCH",
      "params": [],
      "status": "SPEZIFIZIERT",
      "fallback": "nur FOK für kleine Orders",
      "failure_effect": "Algo-Orders gesperrt",
      "account": "Demo",
      "killer_first_rank": 9,
      "requirements": [],
      "scenarios": [
        "OS-EX-02"
      ]
    },
    {
      "id": "KT-10",
      "title": "Stopps bei Limit-Moves",
      "level": "BROKER_CERT",
      "component": "C-MT5",
      "stage": "BS-01",
      "gate": "GATE-G1",
      "procedure": "Beobachtung an einem Limit-Tag (nicht provozierbar); Wiedergabe mit Aufzeichnung",
      "oracle": "SL führt im gesperrten Markt nicht aus und löst bei Wiedereröffnung aus; Zustand bleibt konsistent",
      "pass_criterion": "Orakel erfüllt oder Rückfallvariante gewählt und signiert; Protokoll mit Rohantworten",
      "execution": "BROKER",
      "automation": "HALBAUTOMATISCH",
      "params": [],
      "status": "SPEZIFIZIERT",
      "fallback": "Lückenregel rechnet ohnehin mit Nichtausführung",
      "failure_effect": "keine; Befund dokumentiert",
      "account": "Demo",
      "killer_first_rank": 10,
      "requirements": [],
      "scenarios": [
        "OS-EX-12"
      ]
    },
    {
      "id": "KT-11",
      "title": "Rollen und Verfall",
      "level": "BROKER_CERT",
      "component": "C-MT5",